node,count,count_rescaled,cluster,AI_summary,cluster_name
2차전지,16,30.714285714285715,1,UNIST와 공동연구로 2차전지의 복합전해질막 기술이 개발되었다. 이 전해질막은 기계적 강도와 이온전도도가 뛰어나고 고전압 적층형 셀에도 적용 가능하다. 2차전지 관련 ETF는 2차전지주의 하락세로 수익률이 하락하고 있다. 에코프로머티리얼즈는 중국계 업체의 규제 변화에 대응하고 글로벌 시장을 확대하기 위해 기업공개를 통한 상장에 착수한다. 에코프로머티리얼즈는 이번 자금을 연구개발과 설비 투자에 사용하여 미래 성장을 도모할 계획이다.,에너지
LNG,6,23.57142857142857,1,"한국중부발전이 제주에 액화천연가스 복합발전소를 건설하기로 하여 2027년 완공을 목표로 4090억을 투자할 계획이다. 중부발전은 제주 지역의 전력 수급 특성을 고려하여 LNG 발전설비를 늘리고 있다. SK E&S는 하니엘UOP와 협력하여 국내 발전소에 탄소포집 실증설비를 짓기로 하였다. 이는 민간기업이 주도적으로 실행하는 첫번째 사례이다. 한국과 카타르는 에너지 및 조선업 분야의 공급망 강화에 대한 논의를 진행하였다. 또한, 방문규 산업통상자원부 장관은 지속 가능한 협력을 위해 수소, 재생에너지 등 에너지원의 다양화를 제안하였다.",에너지
강관업체,4,22.142857142857142,1,"현대제철은 강관 사업 자회사 설립을 통해 사업경쟁력을 높이고, 글로벌 에너지용 강관 전문사를 키우기 위한 계획을 밝혔습니다. 강관 사업 자회사는 국내 사업 최적화 및 미국 강관 시장 수익을 기반으로 투자재원을 확보하고, 국내외 생산능력을 확대하여 친환경 에너지사업의 강관 수요에 대응하며 고부가 에너지용 강관 사업을 강화할 예정입니다. 이를 통해 현대제철은 강관사업을 독립시키고 사업재편을 완료하는 계획입니다. 이로써 현대제철은 지속성장 가능한 사업 경쟁력을 강화해 나갈 것입니다.",에너지
건설,35,44.285714285714285,1,"두산건설은 롯데건설, 힐엔지니어링과 공동 개발한 내진보강 기술이 행정안전부의 재난안전 신기술로 지정됐다고 밝혔습니다. 이 기술은 기존 건축물의 기둥에 무수축 모르타르를 충전한 강관을 설치한 후 철골보를 연결해 모멘트골조 프레임을 형성시키는 내진보강 기술입니다. 기존의 내진보강 공법과 비교해 복잡한 공정을 생략할 수 있는 이 기술은 건설 분야에서 혁신적인 역할을 할 것으로 전망됩니다. 베트남 경기 침체로 인해 굴삭기 수입시장에서도 중국의 영향력이 커지고 있습니다. 베트남 내 굴삭기 수입액이 일본을 제치고 중국이 1위를 차지한 것은 경기 침체가 이어지고 있기 때문으로 분석됩니다. 이러한 경향을 고려하여 건설 기계 수출 업체들은 중국 시장에 진출 전략을 세워야 할 것으로 예상됩니다.",에너지
단열재,3,21.428571428571427,1,"금호석유화학의 휴그린 브랜드를 통해 단열재 시장에 본격진출하는 디앤케이켐텍이 성능과 목적에 따라 휴그린 PF보드과 휴그린 PF보드 Core로 제품을 출시한다. 이는 국토교통부의 준불연 소재 관련 규제 강화로 인해 우레탄폼이나 폴리스티렌 등의 단열 소재 수요가 PF보드로 이동할 것으로 예상되는 추세에 맞춘 것이다. 이에 따라 디앤케이켐텍은 품질과 친환경 인증 취득을 준비하고, 생산 설비 증설도 검토하며, 금호피앤비화학과 동성케미컬의 협력으로 탄생한 회사로서의 성장을 기대하고 있다.",에너지
두산로보틱스,3,21.428571428571427,1,"두산로보틱스의 주권이 유가증권시장에 상장될 예정이다. 두산로보틱스는 두산그룹 계열사로 2015년에 설립된 협동로봇 제조업체이다. 상장 당일에는 변동성완화장치가 미적용되며, 상장 첫날 가격 제한폭도 변경된 기준에 따라 적용된다. 
다음달 5일에 상장 예정인 두산로보틱스에 대한 증권가는 모기업 주가의 하락을 우려하며 투자자들이 선제적으로 반응했다. 하지만 장기적으로는 두산 주가가 상승할 것으로 전망된다. 상장 기대감으로 두산 주가는 최고치를 기록했었으나 두산로보틱스의 상장 기대감으로 24% 하락했다.
두산로보틱스는 일반투자자 대상 공모 청약에서 33조원이 넘는 증거금을 모았다. 이는 올해 가장 많은 청약 증거금을 모은 기업으로, 필에너지의 두 배에 달한다. 두산로보틱스의 상장 공동 대표주관사와 공동 주관사에는 총 149만6346건의 일반 청약이 접수됐다.",에너지
부동산,29,40.0,1,"중국 부동산 개발사인 헝다집단의 신규채권 발행 정지 소식에 따라 헝다 주가와 홍콩 항셍지수가 폭락하였다. 헝다는 회생을 위한 부채 조정에 차질이 생기면서 채권 발행 자격을 충족하지 못하게 되었다. 이에 따라 헝다는 오프쇼어 채권 재편안을 제안하고 있다. 

집코노미 박람회에서 진행된 토론에서 부동산 전문가들은 집값 상승세와 재하락에 대해 상반된 주장을 펼쳤다. 윤지해 연구원은 집값 상승세를 예상하며 새 아파트 가격이 오르는 가운데 기존 아파트값이 떨어지는 것은 불가능하다고 지적했다. 

평택 화양지구에서는 부동산 시장이 회복세를 보이며 입지가 우수한 분양단지에 대한 수요가 증가하고 있다. 한화 건설부문이 평택 화양에서 공급하는 포레나 평택화양은 초등학교와 중심상업지구와 인접해 입지가 우수하다는 평가를 받고 있다. 평택 화양지구에는 화양지구 최대규모 공원과 평택시청 안중출장소도 인근에 위치해 있어 향후 다양한 생활인프라를 누릴 수 있을 전망이다.",에너지
"석유화학, 정유",15,30.0,1,"롯데케미칼은 파트너사와 정부와의 석유화학산업 상생협력을 위한 공동선언식을 개최했다. 롯데케미칼은 근로조건 개선, 기술경쟁력 제고, 안정적인 경영환경 조성 등을 위한 방안을 마련해 실천할 계획이다. 파트너사들은 석유화학산업 발전을 위해 근로자의 근로조건 향상과 생산성 향상을 위해 노력할 계획이다. 정부는 석유화학산업의 성장-고용-복지의 선순환 구조 형성을 위해 필요한 제반 사항을 적극 지원할 예정이다. 제주지역의 유가가 상승세를 보이고 있다. 제주지역의 휘발윳 값과 경윳 값이 모두 상승하고 있다. 국제 유가가 상승하면서, 석유화학업계는 정제마진이 개선되어 상반기의 부진을 극복할 수 있게 되었다. 반면 석유화학업계는 경기 침체와 중국발 공급 과잉으로 어려운 시기를 보내고 있다.",에너지
아파트,17,31.428571428571427,1,"청주 아파트 매매시장은 상승과 하락세 간 힘겨루기가 이어지고 있습니다. 그러나 매물 증가와 매물 소화 여부에 따라 향방이 결정될 것으로 보입니다. 집값은 매도 호가를 매수자들이 받아주면 상승할 가능성이 있지만, 관망세가 짙어질 경우 보합세를 유지할 가능성이 높아 보입니다. 직방에 따르면 10월에는 아파트 입주물량이 수도권에서 2배 이상 증가하고 지방에서는 8% 감소했습니다. 수도권에서는 재개발 정비사업이 끝난 대규모 단지의 입주로 인해 물량이 늘어났습니다. 전국의 아파트 매매가와 전세가는 오름세를 보이고 있지만 상승 폭은 둔화되었습니다. 상승 기대감은 유지되지만 매수 문의가 감소하고 관망세가 길어져 상승 폭이 축소된 것으로 보입니다.",에너지
전구체,3,21.428571428571427,1,"에코프로머티리얼즈는 상장을 통해 2027년까지 21만t의 생산능력을 확보하여 글로벌 전구체 제조기업으로 도약하려고 합니다. 이를 위해 RMP 공정을 개발하고 저순도 니켈 혼합물을 저렴하게 수입해 전구체의 부가가치를 높였습니다. 또한, 포항 CPM 1, 2공장에서 연간 전구체 5만t을 생산하며 2027년까지 21만t로 생산능력을 4배 이상 높일 예정입니다. 하반기에는 3, 4공장을 착공하고 북미, 유럽 등에도 진출할 계획입니다. 이에 따라 중국 GEM, CNGR, 화유코발트 등과 경쟁하여 하이니켈 전구체 생산능력이 예상됩니다.",에너지
정보보호,5,22.857142857142858,1,"SK가스와 KCC글라스는 정보보호와 개인정보보호 관리체계 인증을 획득했다. 이 인증은 국내 최고 수준의 종합 정보보호 및 개인정보보호 관리체계 인증제도로, 정보통신망법에 따라 기업의 고객 정보보호 관리체계가 해당 인증 기준에 적합한지 심사된다. SK가스와 KCC글라스는 정보보호 체계를 구축하고 인프라와 취약점을 보완해 인증을 받았다. 이를 통해 기업 및 고객 정보를 체계적으로 관리하는 기업으로 인정받게 되었다. SK가스는 자발적으로 인증을 진행했으며, KCC글라스는 정보보호를 강화하고 고객에게 안전한 서비스를 제공하기 위해 인증을 획득했다. 이러한 노력은 정보보호에 대한 위협이 커지는 상황에서 더욱 중요하며, 앞으로도 더 많은 기업들이 정보보호 프로세스를 고도화할 것으로 예상된다. SK가스는 ESG 경영을 강화하기 위해 자발적으로 인증을 진행한 것으로 전해졌다.",에너지
철강,10,26.428571428571427,1,"동남아 10개국의 철강 생산 능력은 3년 후 최대 35% 성장할 것으로 예상되며, 포스코와 현대제철 등 한국 철강업체들의 수출전선에 불확실성이 높아지고 있다. 이에 따라 포스코급 철강회사 2곳이 생겨날 전망이다. 철강업체들은 추석 연휴에도 정상 조업을 진행하며, 사고 예방을 위해 고로와 연주 설비를 점검한다. 일본 철강회사들은 자국 시장 가격보다 30% 할인된 가격으로 한국 시장에서 제품을 판매하고 있어, 한국 철강사들의 주문은 감소하고 자국 제품의 비중은 증가하고 있다. 이는 가격 때문으로 분석되고 있다.",에너지
탄소포집,3,21.428571428571427,1,"SK E&S와 하니웰 UOP가 함께 탄소포집 실증 설비를 구축하기 위한 공동개발 협약을 체결했습니다. 이번 협약을 통해 SK E&S는 하니웰 UOP의 탄소포집 기술을 발전소 부지에 적용할 예정입니다. 이는 민간 부문에서 천연가스 발전 탄소포집 실증을 진행하는 첫 사례입니다. 두 회사는 기본설계에 착수하고 상용화 방안을 논의할 계획입니다. SK E&S는 발전소 부지와 인허가, EPC를 담당하며 하니웰 UOP는 ASCC 탄소 포집 기술을 제공하고 기술 개발에 참여합니다.",에너지
폐배터리,4,22.142857142857142,1,"한 뉴스 기사에 따르면 SK에코플랜트와 미국의 어센드 엘리먼츠가 합작하여 폐배터리 재활용 기업을 설립하였다. 이 합작법인은 미국에서는 첫 한·미 합작 폐배터리 재활용 기업으로, SK에코플랜트가 64%, 테스가 11%, 어센드 엘리먼츠가 25%의 지분을 가지게 된다. 이 합작법인은 새로운 전처리 공장에서 전기차 배터리 생산 과정에서 발생하는 불량품과 수거된 폐배터리를 안전하게 처리하여 배터리 원료를 추출할 것이다.

또 다른 뉴스 기사에 따르면 소니드의 자회사인 소니드리텍이 뉴질랜드 리사이클링 기업인 업사이클과 협약을 체결하였다. 소니드리텍은 지정폐기물종합재활용업 인허가를 받아 완벽한 리사이클링 설비를 갖추고 있으며, 납축전지 리사이클링 사업으로 순연과 합금연을 생산하고 있다. 소니드리텍은 업사이클로부터 폐배터리 리사이클링 공장 기술 이전 및 플랜트 공급을 받아 향후 재생연공장 플랜트 수출 및 전기차 2차전지 리사이클링 전처리 공장 설립을 위한 기술과 컨설팅을 제공할 것이다.

또 다른 뉴스 기사에 따르면 소니드는 자회사인 소니드리텍과 뉴질랜드의 업사이클과 협약을 체결하였다. 이 협약을 통해 소니드리텍은 향후 재생연공장 플랜트 수출 및 전기차 2차전지 리사이클링 전처리 공장 설립을 위한 기술과 컨설팅을 받게 된다. 업사이클은 소니드리텍에게 블랙매스 등의 원료를 공급할 예정이다. 이번 협약은 2023 대한민국소싱워크에서 진행되었다.",에너지
해상풍력,8,25.0,1,"해상풍력 관련 뉴스 기사 3가지를 요약해보면 다음과 같습니다. SK에코플랜트가 안마 해상풍력 우선협상대상자로 선정되어 해상풍력 조성과 국내 청정 에너지 공급, 고용 창출을 목표로 협상을 진행하고 있습니다. HD현대일렉트릭이 전라북도와 협력하여 전북 해상풍력 사업을 활성화하기 위한 업무협약을 체결하였습니다. SK에코플랜트와 자회사 SK오션플랜트는 국내 최대 규모인 500MW급의 해상풍력 사업을 수주하였고, 해상풍력 하부구조물 제작부터 설치까지 맡게 되었습니다. SK에코플랜트는 SK오션플랜트를 인수하여 해상풍력 분야의 전반적인 밸류체인을 확보하였습니다. 이를 통해 국내 해상풍력 시장에 진출하게 되었습니다.",에너지
CJ CGV,3,21.428571428571427,2,"CJ CGV는 CJ올리브네트웍스 지분을 현물 출자받기 위해 법원에 제출한 회계법인의 감정평가 보고서가 불인가 결정을 받아 계획에 차질이 생겼습니다. CJ CGV는 1조원 규모 자본 확충을 위해 유상증자를 계획하고 있었습니다. 그러나 법원은 CJ올리브네트웍스의 당기순이익이 감소하고, 영업이익률이 감소하는 상황에서 감정 보고서의 판단이 믿기 어렵다고 판단하여 불인가 결정을 내렸습니다. 따라서 CJ CGV의 자본 확충 계획이 불투명해졌습니다. CJ CGV는 유상증자로 신주를 발행하려는 자금 조달 계획을 가지고 있었지만, 법원의 불인가 결정으로 계획이 변경될 가능성이 있습니다. CJ CGV 주가는 유상증자 발행가액이 종가보다 낮아지면서 하락세를 보이고 있습니다. 이에 따라 CJ CGV의 신규 상장을 앞두고 주가가 급락하는 상황입니다.",금융 및 건설
HD현대중공업,1,20.0,2,"HD현대중공업은 최대 2000억 원 규모의 회사채 발행을 추진하고 있으며, 1.5년물과 2년물로 1000억 원 규모의 회사채를 발행할 예정입니다. NH투자증권, KB증권, 미래에셋증권, 신한투자증권, 삼성증권이 대표주간사로 지정되었습니다. 발행 가능성에 따라 최대 2000억 원 규모의 증액발행도 고려될 수 있습니다. 다음달 17일 수요예측을 통해 25일에 발행할 예정입니다.",금융 및 건설
건설 중소형,20,33.57142857142857,2,"정부는 주택공급 활성화를 위해 주택 공급 조치를 심의하고 있으며, 공공주택 물량 확대와 민간주택 공급 개선이 중점이다. 이에 따라 주택이 충분히 공급될 수 있도록 공공과 민간의 공급을 보완하고 주택 사업 여건을 개선하겠다는 방침이다. 중대산업재해 발생 사실을 공표한 건설사인 온유파트너스는 작업 중 안전조치 미비로 사고가 발생했다. 이에 따라 중대산업재해 처벌법에 따라 사업장의 명칭, 재해 내용 등을 공표하게 되었다. 현대건설은 힐스테이트 관악센트씨엘을 분양하기 시작했으며, 단지 내에는 다양한 시설과 편의시설이 제공된다. 이 아파트는 지역 내 랜드마크 단지로서 수요자들의 많은 관심을 기대하고 있다.",금융 및 건설
금융,28,39.28571428571429,2,"금융지주와 은행이 개인 투자용 국채 판매 대행 기관에 입찰에 참여하고, 경쟁이 예상됩니다. 은행이 증권사에 비해 제한적인 투자중개업 인가만으로 개인 투자용 국채 판매를 할 수 있는지에 대한 해석을 금융위원회에 요청한 기재부의 결정입니다. 은행의 대출과 예금 금리가 빠르게 상승하고 있습니다. 특히 주택담보대출 금리는 3개월 연속 올랐으며, 전세대출은 연 4%대, 주택담보대출과 신용대출은 각각 연 5%대, 6%대가 예상됩니다. 가계대출 금리가 상승세를 보이고 있는 가운데, 가계대출 증가가 꺾일지에 대한 관심이 증가하고 있습니다.",금융 및 건설
금융결제원,4,22.142857142857142,2,"하나증권은 금융결제원과 협업하여 금융인증서를 발급하고 홈트레이딩시스템에 적용하였습니다. 금융인증서는 번거로운 절차 없이 저장되어 금융서비스와 정부·공공서비스에 사용 가능합니다. 하나증권은 모바일트레이딩시스템에서도 금융인증서 발급 서비스를 시작했으며, 향후 서비스 개선을 통해 안전하고 편리한 증권 거래를 지속 제공할 예정입니다. 이로써 하나증권 고객은 모바일 트레이딩 시스템에서 모든 서비스에 금융인증서를 사용할 수 있게 되었습니다.",금융 및 건설
금융지주,10,26.428571428571427,2,국내 10개 금융지주사의 연결 기준 당기순이익은 13조6238억원으로 전년 동기 대비 10.1% 증가했다. 이에 따라 국내 금융지주사들의 순이익이 10% 증가한 것으로 나타났다. 그러나 6월 말 은행지주의 자본비율은 상승하였으나 규제 비율을 상회하여 부채비율은 하락하였다. 금융지주의 대손충당금 적립률은 감소하였고 고정이하여신비율은 상승하였다. 윤종규 KB금융지주 회장은 KB금융그룹 창립 15주년을 맞아 고객만족 최고의 리딩금융그룹이 되겠다는 의지를 밝혔다. 그는 노란색 넥타이를 매고 9년간 KB금융을 자랑스러워했다.,금융 및 건설
대출,20,33.57142857142857,2,"한국은행은 2023년 9월 금융안정 상황 보고서에서 약한고리인 청년과 고령층의 대출 부실에 대한 경고음을 내놨다. 특히 2금융권에서 빌린 개인사업자 대출 비중이 높은데, 경기 부진으로 상환능력 악화 가능성이 있다는 것이다. 또한 고령층의 개인사업자 대출 비중은 다른 연령층에 비해 높으며, 대출금액은 늘어나고 있는 반면 소득은 낮아 부실 우려가 있다. 청년층의 경우에도 가계대출 규모를 늘리면서 실거주용 주택에 수요가 몰리고 있다. 한은은 청년층이 전세자금 대출을 확대하면서 주택담보대출을 활용해 주택 구입에 나설 것으로 판단했다.",금융 및 건설
벤처,4,22.142857142857142,2,"산업부는 내달 31일까지 운용사 모집을 통해 국내 산업 혁신 생태계 경쟁력을 제고하기 위한 벤처캐피탈 스케일업 펀드를 조성한다고 밝혔다. 이를 통해 국내 산업 혁신 생태계의 경쟁력도 높아질 것으로 예상된다. 또한, 산업은행과 BNK금융지주를 포함한 주체들이 함께 출자해 부산 미래성장 벤처펀드를 조성하고, 이를 통해 부산지역 혁신 기업의 성장과 도약을 지원할 예정이다. 이를 통해 부산의 경쟁력과 국가의 경쟁력을 동시에 향상시킬 수 있을 것으로 기대된다.",금융 및 건설
보험,19,32.857142857142854,2,"보험 연구원이 실시한 설문조사에 따르면, 국내 보험사 CEO 중 26%는 내년 CSM 성장률이 11% 이상으로 늘어날 것이라고 전망했습니다. 또한, 보험사 CEO들은 종신보험과 건강보험과 같은 보장성보험을 주력 상품전략으로 삼을 것으로 예상됩니다. 이는 CSM에 유리한 보장성보험 판매를 통해 실적 개선을 꾀하고 있는 것으로 보입니다. CEO들은 현재 보험시장 영업경쟁 수준이 강하다고 평가하며, 이는 법인보험대리점의 높은 시장지배력과 변화된 회계제도가 주요 영향요소로 지목되었습니다.",금융 및 건설
재개발,7,24.285714285714285,2,"올해 분양한 아파트 중 재건축·재개발 지역이 일반 지역보다 확연하게 높은 청약 경쟁률을 기록했습니다. 이는 평균 7.7대 1로 재건축·재개발 지역이 높은 경쟁률을 보인 것입니다. 수도권에서 가장 높은 청약 경쟁률을 기록한 단지는 서울시 동대문구 청량리제7구역주택재개발 정비사업으로 공급된 청량리 롯데캐슬 하이루체입니다. 이 단지는 88가구 모집에 2만1322명이 청약해 평균 242.3대 1의 경쟁률을 기록했습니다. 지방에서는 대전시 서구 숭어리샘주택재건축정비사업을 통해 분양한 둔산 자이 아이파크가 평균 66.67대 1로 높은 경쟁률을 기록했습니다. 

여의도 1호 재건축 수주전재건축 공사비 7740억원 제안한 현대건설이 한양아파트 재건축에 최소 3억6000만원 이상을 환급하는 전략을 제안했습니다. 이는 경쟁사인 포스코이앤씨가 제안한 7020억원보다 720억원 높은 금액입니다. 현대건설이 제안한 디에이치 여의도퍼스트 조감도에는 개발 이익 극대화를 통한 소유주 환급 전략이 깔려있습니다.

대치동 은마아파트가 27년 만에 재건축 추진을 위해 조합을 설립하게 됐습니다. 1979년 준공된 은마아파트는 1996년부터 재건축을 추진해 왔지만 정부와 서울시의 규제와 주민 간 갈등으로 27년간 제대로 재건축을 추진하지 못했습니다. 그러나 이제 강남구는 은마아파트 재건축정비사업에 대한 조합설립인가를 처리했습니다.",금융 및 건설
조선,7,24.285714285714285,2,"조선 테마에 대한 이슈와 전망을 요약하면 다음과 같습니다. BNK부산은행이 삼성중공업에 약 3억 7900만 달러 규모의 선수금 환급보증을 발급하여 조선업의 경쟁력 강화를 위한 금융 지원에 나섰습니다. 이는 국내 조선사의 수주가 회복되고 있음을 보여줍니다. 또한, 정기선 사장은 친환경과 지속 가능한 미래를 강조하면서 미래를 위한 친환경 사업 확장에 힘을 싣고 있습니다. 이를 통해 조선사의 친환경 기술 개발과 사업 확장이 계속될 것으로 전망됩니다. 또한, 이상룡 투자금융본부장은 정책금융기관과 협업해 국내 조선사에 대한 금융지원을 추진하겠다고 밝혔습니다. 이는 국내 조선사의 경쟁력을 높이고 지속적인 성장을 이끌어낼 것으로 예상됩니다. 부산은행은 조선업 지원 확대 및 해양투자 사업 다각화를 추진하고 있으며, 조선업 지원 확대를 위한 다양한 금융지원 정책을 시행할 예정입니다. 이를 통해 조선업의 경쟁력 강화와 지속적인 성장이 기대됩니다.",금융 및 건설
주담대,4,22.142857142857142,2,"내년 1월 시작되는 비대면 주담대 대환대출 서비스 이용이 추천되며, 주담대의 경우 아파트를 담보로 한 대출만 비대면 이동을 할 수 있습니다. 금융당국은 내년 1월 출시를 목표로 비대면 주담대 대환대출 인프라 구축을 진행하고 있으며, 인프라가 성공적으로 구축되면 고객들은 금융사 영업점을 방문하지 않고도 하나의 모바일 앱을 통해 일주일 내 더 낮은 금리의 대출로 갈아타기를 할 수 있게 됩니다. 주담대 평균금리는 4%대를 형성하고 있으며, 은행연합회 공시에 따르면 5대 은행과 인터넷은행의 7월말 잔액기준 주담대 평균금리는 카카오뱅크 4.07%, 우리은행 4.08%, 신한은행 4.20%, 케이뱅크 4.27%, 하나은행 4.28%, 농협은행 4.45%, 국민은행 4.46% 등으로 나타났습니다. 주담대·전세대출 대환대출 인프라 구축을 완료하고 연말 또는 내년 1월 서비스를 시작한다고 금융위원회가 밝혔으며, 파급 효과가 작지 않을 전망입니다.",금융 및 건설
주택공급,15,30.0,2,"정부가 주택공급을 확대하기 위해 3기 신도시에 3만가구 이상을 추가 공급하기로 했습니다. 이번 공급대책은 3기 신도시 물량 확충을 비롯한 공공주택 공급 확대, 민간 공급 활성화, 비아파트 공급 확대를 중점으로 이뤄졌습니다. 이에 따라 정부는 5만5000호의 주택을 추가로 확보할 예정입니다. 대한주택건설협회에 따르면, 다음 달 중견 주택업체 13개 사가 아파트 5684가구를 분양할 예정이라고 밝혔습니다. 또한, 정부는 비아파트 건설자금 지원과 정비사업 절차 개선을 통해 민간 공급물량 확대를 유도할 계획입니다.",금융 및 건설
