node,count,count_rescaled,cluster,AI_summary,cluster_name
토스뱅크,3,21.428571428571427,2,"토스뱅크가 2850억원 규모의 유상증자를 진행하여 총 납입 자본금이 1조9350억원으로 늘어나게 됩니다. 유상증자를 통해 지속적인 규모의 성장을 이어갈 계획이며, 주주사들의 지원 속에 재무건전성도 강화했습니다. 토스뱅크는 고객들과 주주사의 신뢰를 바탕으로 차별화된 기업가치를 인정받을 수 있었으며, 향후 흑자 달성을 기반으로 지속적인 성과를 이어갈 것이라고 밝혔습니다.",금융 및 건설
토큰증권,4,22.142857142857142,2,"KB증권, 신한투자증권, NH투자증권은 토큰증권 시장 공동 진출을 위해 토큰증권 증권사 컨소시엄 구성 전반에 대한 업무협약을 체결했다고 밝혔습니다. 이를 통해 토큰증권 시장 활성화를 위한 대형 증권사의 공동 인프라 구축 및 사업모델 발굴 등을 협력할 예정입니다. 이들 3사는 컨소시엄을 통해 토큰증권 공동 인프라 구축, 정책 공동 대응, 발행 및 유통 서비스 시너지 사업 모델 발굴 등을 상호 협력해 진행할 예정입니다. 공동 분산원장을 구성하게 되면 토큰증권 사업 영업에 집중할 수 있을 뿐만 아니라, 다양한 기초자산을 보유한 발행사를 확보하고 상품 발행 및 유통이 가능한 플랫폼을 제공할 수 있을 것으로 예상됩니다. KB증권과 신한투자증권, NH투자증권은 이미 토큰증권 시장에 대한 개발과 검증을 진행한 경험을 가지고 있으며, 이를 통해 토큰증권 시장에서의 경쟁력을 강화할 수 있을 것으로 기대됩니다.",금융 및 건설
디스플레이,17,31.428571428571427,4,"한 기사에서는 KAIST가 차세대 디스플레이 기술 개발에 성공했으며, 안경형 증강·가상 현실 기기에 적용할 수 있는 작은 패턴을 구현했다고 보도했습니다. 또 다른 기사에서는 LG디스플레이가 폴더블 노트북용 OLED를 출시했으며, 기존 제품보다 수명을 늘린 탠덤 OLED 소자 구조와 주름 현상 최소화 기술을 적용했다고 전했습니다. 마지막 기사에서는 제네시스가 GV80 부분변경 모델을 출시하고, 첫 쿠페형 SUV인 GV80 쿠페를 공개했다고 보도했습니다.",스마트폰
폴더블폰,5,22.857142857142858,4,"LG전자가 그램의 기술과 디자인 혁신을 담은 폴더블 노트북 LG 그램 폴드를 출시한다. 폴더블 폼팩터에 맞춰 최적의 UI/UX와 다양한 주변 기기와의 연결성을 강화하였다. 폴더블 노트북은 접으면 12형 노트북, 펼치면 17형 태블릿, 전자책 등 다양한 형태로 변환된다. 폴더블 폼팩터의 장점인 자발광 올레드를 활용하여 얇고 구부리기 용이하며, 화면을 펼쳤을 때 가장 두꺼운 부분의 두께는 9.4mm로 얇아진다. 다양한 사용자경험을 제공하기 위해 가상 키보드와 블루투스 키보드를 활용할 수 있도록 하였다.",스마트폰
우주항공산업,5,22.857142857142858,0,"한일 항공우주 중심지 경남도와 아이치현은 항공우주산업에서 중요한 역할을 하는 지자체이다. 경남도에는 한국항공우주산업을 포함한 기업들이 국내 항공 산업의 65%를 담당하고 있고, 아이치현은 일본 전체 항공우주산업 생산의 45.7%를 차지하고 있다. 경남도와 아이치현은 이달 26일부터 일본 나고야에서 열리는 항공우주 전시회인 에어로마트 나고야 2023에 함께 참가할 예정이다. 이는 양국 항공우주산업의 협력을 통해 우리 기업에 많은 수출 기회가 제공될 수 있다는 의미이다. 과기정통부는 우주항공청 설립에 대한 대립이 발생하고 있으며, 한국항공우주연구원과 한국천문연구원을 우주항공청 산하기관으로 둘지에 대한 논의가 진행중이다.",항공산업
항공기부품,18,32.14285714285714,0,한국 항공사 제주항공은 오는 11월 10일부터 인천에서 마카오로 주 7회 일정으로 재운항을 시작한다고 밝혔습니다. 이는 중화권 입국자의 비중이 높아 항공기부품 수요가 증가할 것으로 전망됩니다. 수요 회복세에 따라 중국과 일본 항공 노선 수요가 회복되어 항공사들이 재운항과 신규 취항을 확대하고 있습니다. 한진그룹 회장은 기업결합 승인을 위해 연매출 3조 화물사업을 매물로 내놓을 계획이라고 밝혔습니다. 대한항공은 아시아나항공 화물 사업부를 포기할 가능성이 있는 것으로 알려졌습니다.,항공산업
인공지능,22,35.0,5,"1. 오픈AI는 애플 전 디자이너 조니 아이브와 함께 소프트뱅크로부터 10억 달러 지원을 받아 AI의 아이폰 개발을 위한 협의를 진행 중입니다.
2. 오픈AI 최고경영자는 아이브와 함께 AI와 상호 작용할 수 있는 보다 자연스럽고 직관적인 사용자 경험을 제공하는 기기 개발을 목표로 하고 있다고 전했습니다.
3. 한화는 고려대와 손잡고 인공지능 경쟁력을 제고하고, 업무 프로세스 최적화와 비즈니스의 민첩성 및 효율성을 높이는 AI 및 DT 프로젝트를 공동으로 수행할 예정입니다.
4. 한화는 또한 AI 및 스마트 제조 영역 교육 프로그램을 운영해 전문 인력을 양성하고, 산업계와 학계의 협력을 촉진할 계획입니다.
5. 엔비디아는 최근 하락세가 이어지던 가운데 저가 매수가 유입되어 상승하며 생성형 인공지능 최대 수혜주로 주목받고 있습니다.",AI Chat
챗봇,10,26.428571428571427,5,"1. 인공지능 챗봇의 발전으로 냉장고 사진을 보내면 음성 명령으로 메뉴 제안과 대화가 가능해지는 기능이 추가될 예정입니다.
2. CEO풍향계를 통해 한 회사의 최고 경영자는 글로벌 금융그룹 도약에 아쉬움을 표현하며 성과와 자괴감을 언급했습니다.
3. 한화와 고려대학교의 산학협력을 통해 생성형 AI 역량을 확보하고, 데이터 인사이트 확보와 업무 최적화를 위한 공동 프로젝트를 진행할 예정입니다.",AI Chat
자동차 대표주,17,31.428571428571427,3,"현대자동차는 인도에서의 연간 판매량 80만대와 점유율 20% 달성을 위해 다양한 전략을 추진하고 있다. 이를 위해 현지 딜러와의 시너지를 강화하고 고객과의 접점을 확대하는 등 브랜드 인지도를 높이기 위한 노력을 계속할 것이라고 밝혔다. 인도에서 현대자동차는 다양한 전략 차종을 앞세워 매년 40만대 이상의 차량을 판매하고 있으며, 인도 누계 판매 800만대를 돌파했다. 

르노코리아자동차는 신규 판매 조건으로 무이자 할부 상품을 추가하고 추석 연휴 기간에는 신차 구매 고객의 계약금도 면제하는 혜택을 제공한다. 무이자 할부 혜택을 받는 고객은 최대 90만원의 할인을 받을 수 있으며, 재구매 범위 확대 혜택도 시행된다.

도이치모터스는 주가 안정과 주주가치 제고를 위해 자사주 100만주를 직접 취득하기로 결정했다. 이익 부분에서도 BMW 브랜드의 신차 출시 모멘텀에 따른 호실적 기대 속에 재무지표는 양호해질 것으로 전망된다. 도이치모터스는 오프라인 거점을 넓혀 외연 확대에 성공한 회사로, 그룹 계열사들과의 시너지가 커질 것으로 기대하고 있다.",자동차
전기차,40,47.85714285714286,3,"LG전자 사장 조주완은 전기차를 직접 양산할 계획은 없지만 전장 부문 연간 매출을 끌어올리겠다는 포부를 밝혔습니다. 조 사장은 ""2030년까지 차량용 솔루션 사업에서 연간 매출 170억달러를 창출하는 것이 목표""라고 말했습니다. 알멕은 미국 전기자동차 완성차 업체 루시드와 파트너십 계약을 체결하고 전기차 전용 제품 공급을 주요 사업으로 영위하고 있습니다. 한편, 산업통상자원부 장관은 현대차 아산공장을 방문해 전기차 수출 확대를 위한 정부 차원의 지원을 약속했습니다. 현대차를 비롯한 자동차기업 및 지원기관 대표가 참석해 자동차 수출 확대 방안을 논의했습니다.",자동차
대표주,16,30.714285714285715,99,"대표주 테마에 대한 이슈와 전망을 요약하면 다음과 같습니다. 상반기 한국 100대 기업의 경영실적이 미국 100대 기업과 비교해 매우 저조하며, IT와 에너지 분야에서 특히 큰 감소폭을 보였습니다. 한편, 합병으로 인해 대한항공과 아시아나항공이 화물 점유율 73.4%를 갖게 되는데 이로 인해 운송비 상승과 파업리스크가 우려되고 있습니다. 또한, 3분기 실적시즌이 다가오는데 상장사들의 순이익이 시장 기대치에 미치지 못할 가능성이 크다는 지적이 나왔습니다. 이는 주요 IT 기업의 영업이익 추정치 하향조정과 정보통신 업종의 회복 지연으로 인해 발생하고 있습니다.",그 외
이재명,12,27.857142857142858,99,"이재명 더불어민주당 대표에 대한 체포동의안 가결로 인해 이재명 관련주들이 급락하고, 이낙연 전 더불어민주당 대표와 한동훈 법무부 장관 테마주가 급등하고 있습니다. 정치테마주의 변동성이 심화되고 있으며, 내년 총선에 점점 다가옴에 따라 변동성이 더욱 심해질 것으로 예상됩니다. 이재명 테마주로 분류되는 동신건설이 상승하며, 이재명 대표의 구속영장 기각 가능성에 대한 투자자들의 예상으로 인해 이재명 테마주가 오르고 있습니다.",그 외
농업,14,29.285714285714285,99,"농식품 수출액이 전년 대비 0.4% 증가한 63억1000만달러를 기록하며 농업 수출은 성장세를 보였습니다. 이는 가공식품과 신선식품의 수출 성장세에 힘입은 것으로 분석되었습니다. 스마트팜과 농기자재 등 전후방산업도 상승세를 보이며 케이푸드 플러스 수출은 1.8% 증가한 84억 6000만달러를 기록했습니다. 또한, 농생명 슈퍼컴퓨팅센터의 준공으로 농업과 생명·보건 분야의 연구개발이 활발해질 것으로 전망되었습니다. 이에 따라 농업의 경쟁력을 높이고 세계시장에서 우리 농업의 위치를 확고히 할 수 있을 것으로 기대됩니다. 중국은 리오프닝 효과 등으로 대부분의 품목에 걸쳐 수출 상승세를 기록하고 있습니다.",그 외
해외주식,10,26.428571428571427,99,"대신증권과 KB증권, 메리츠증권은 추석 연휴기간에도 해외주식 데스크를 운영한다고 밝혔습니다. 추석 연휴동안에도 해외주식 주문을 할 수 있으며, 해외주식 거래는 유선 거래뿐 아니라 온라인 매체를 통해서도 가능합니다. 또한, KB증권은 글로벌원마켓 서비스를 통해 24시간 거래가 가능하며, 메리츠증권은 해외주식 거래에도 통합 증거금 서비스를 제공해 환전 없이 매수할 수 있습니다. 해외주식뿐 아니라 해외파생 상품에 대한 거래도 가능하며, 비대면 고객을 대상으로 수수료 및 환전 수수료 인하 이벤트를 진행하고 있습니다.",그 외
반도체,43,50.0,99,"1. KB증권은 삼성전자가 북미 데이터센터 고객사로부터 메모리반도체 주문을 받아 재고 감소가 나타나고 있다고 강조했습니다.
2. 이는 주요 고객사들이 재고 조정을 마무리하고 수요 감소에도 주문량을 늘리고 있기 때문입니다.
3. 또한, 북미 4대 데이터센터 업체들의 반도체 재고 조정도 막바지 단계에 접어들고 있으며, 고객사들은 삼성전자의 가격 인상 요구를 수용하기 시작한 것으로 보입니다.
4. 4분기부터 메모리 반도체 시장은 수급 개선과 가격 상승이 동시에 나타날 전망이며, 삼성전자의 강도 높은 감산이 연말까지 지속될 것으로 예상됩니다.
5. 또한, 삼성전자의 감산 정책이 메모리 반도체 구매 심리를 변화시키고 있으며, 내년부터는 상승 사이클의 기울기가 가파르게 전개될 것으로 기대됩니다.",그 외
